{
  "schema_version": "0.2-candidate",
  "run_id": "9d63df0a-4436-4fe3-a589-fbc53c16cc8e",
  "case_id": "EVAL-7734FA609F41688C",
  "asset_sha256": "f7721de02a6af10bf87f3aedb947a539efacd9437e4574d4fc968ebd895f931e",
  "system": {
    "name": "COMP3888-music-baseline",
    "version": "0.1.0",
    "source_revision": "sha256:45c37462ab33f8df5bc823e70b83cd9071e99196af3faf5b00af3060ae0d9de6"
  },
  "execution_status": "unsupported",
  "axes": {
    "completeness": {
      "availability": "unavailable",
      "value": null,
      "confidence": null,
      "reasoning": "This evaluation has no result for this axis."
    },
    "integrity": {
      "availability": "unavailable",
      "value": null,
      "confidence": null,
      "reasoning": "This evaluation has no result for this axis."
    },
    "attestation_strength": {
      "availability": "unavailable",
      "value": null,
      "confidence": null,
      "reasoning": "This evaluation has no result for this axis."
    },
    "ai_disclosure": {
      "availability": "unavailable",
      "value": null,
      "confidence": null,
      "reasoning": "This evaluation has no result for this axis."
    }
  },
  "validation": {
    "validation_state": null,
    "signature_present": null,
    "signature_valid": null,
    "cryptographically_valid": null,
    "credential_trusted": null,
    "codes": [],
    "reasons": []
  },
  "findings": [
    {
      "code": "UNSUPPORTED_INPUT",
      "severity": "info",
      "message": "This target evaluates WAV audio only; PNG/MP4 are unsupported."
    }
  ],
  "processing_ms": 95.39020899683237,
  "resource_usage": {
    "cpu_ms": 0.2590000000000092,
    "peak_rss_kib": null
  },
  "error": "This target evaluates WAV audio only; PNG/MP4 are unsupported."
}
