{
  "schema_version": "0.2-candidate",
  "run_id": "9039916b-e89a-478b-b77a-179506418e60",
  "case_id": "EVAL-C63FB025CDCAA23A",
  "asset_sha256": "77356ffea5b8af0ca673490e77cc87c2aaed8242c81dffee0d396d223a3f0df8",
  "system": {
    "name": "COMP3888-music-baseline",
    "version": "0.1.0",
    "source_revision": "sha256:45c37462ab33f8df5bc823e70b83cd9071e99196af3faf5b00af3060ae0d9de6"
  },
  "execution_status": "succeeded",
  "axes": {
    "completeness": {
      "availability": "partial",
      "value": 1.0,
      "confidence": null,
      "reasoning": "1/1 declared reachable objects were available and hash-matched. This measures declared-object availability only; required musical evidence is not yet agreed."
    },
    "integrity": {
      "availability": "unavailable",
      "value": null,
      "confidence": null,
      "reasoning": "Hash and PCM checks completed for available files. A combined integrity scoring policy has not been defined; inspect findings."
    },
    "attestation_strength": {
      "availability": "unavailable",
      "value": null,
      "confidence": null,
      "reasoning": "No signature trust evaluation is implemented in this target."
    },
    "ai_disclosure": {
      "availability": "unavailable",
      "value": null,
      "confidence": null,
      "reasoning": "No verified AI-disclosure extraction/scoring is implemented in this target."
    }
  },
  "validation": {
    "validation_state": null,
    "signature_present": null,
    "signature_valid": null,
    "cryptographically_valid": null,
    "credential_trusted": null,
    "codes": [],
    "reasons": []
  },
  "findings": [
    {
      "code": "WAV_OBSERVATION",
      "severity": "info",
      "message": "Measured WAV properties and extracted metadata.",
      "evidence_hash": "77356ffea5b8af0ca673490e77cc87c2aaed8242c81dffee0d396d223a3f0df8",
      "observed": {
        "duration_seconds": 8.0,
        "sample_rate_hz": 48000,
        "channels": 1,
        "bit_depth": 16,
        "format": "WAV",
        "codec_subtype": "PCM",
        "file_size_bytes": 781666
      },
      "embedded_metadata": {
        "core_format": {
          "audio_format_code": 1,
          "audio_format": "PCM",
          "num_channels": 1,
          "sample_rate_hz": 48000,
          "byte_rate": 96000,
          "block_align": 2,
          "bits_per_sample": 16,
          "data_size_bytes": 768000,
          "duration_seconds": 8.0
        },
        "info": {},
        "broadcast_extension": null,
        "cue_points": [],
        "sampler": null,
        "fact": null,
        "id3": null,
        "other_chunks": [
          {
            "chunk_id": "C2PA",
            "size": 13614,
            "note": null
          }
        ],
        "warnings": []
      },
      "claim_mismatches": []
    },
    {
      "code": "POLICY_NOT_CONFIGURED",
      "severity": "info",
      "message": "No target-owned authorship decision policy is configured; no accepted/rejected decision is emitted."
    }
  ],
  "processing_ms": 97.20116696553305,
  "resource_usage": {
    "cpu_ms": 1.2820000000000054,
    "peak_rss_kib": null
  },
  "error": null
}
